{
  "$schema": "https://raw.githubusercontent.com/plasmo-corp/bpp/v2/keys.schema.json",
  "chrome": {
    "clientId": "123",
    "refreshToken": "789",
    "extId": "abcd"
  },
  "firefox": {
    "extId": "aaaaaaa-aaaa-bbbb-cccc-dddddddddddd",
    "apiKey": "abcd",
    "apiSecret": "efgh"
  },
  "edge": {
    "clientId": "aaaaaaa-aaaa-bbbb-cccc-dddddddddddd",
    "clientSecret": "abcdefg",
    "productId": "aaaaaaa-aaaa-bbbb-cccc-dddddddddddd",
    "accessTokenUrl": "https://login.microsoftonline.com/aaaaaaa-aaaa-bbbb-cccc-dddddddddddd/oauth2/v2.0/token"
  },
  "opera": {
    "packageId": "123",
    "csrftoken": "abcd",
    "sessionid": "abcd"
  },
  "safari": {
    "bundleId": "com.plasmo.mock",
    "appName": "Plasmo Mock",
    "appCategory": "developer-tools",
    "appleId": "DEVELOPER_APPLE_ID",
    "teamId": "APPLE_DEVELOPER_TEAM_ID",
    "teamName": "Plasmo Corp.",
    "keyId": "APP_STORE_CONNECT_API_KEY_ID",
    "issuerId": "APP_STORE_CONNECT_API_ISSUER_ID",
    "key": "APP_STORE_CONNECT_API_KEY",
    "matchPassword": "YOUR_MATCH_ENCRYPTION_PASSWORD",
    "matchGitUrl": "YOUR_MATCH_REPO"
  }
}
